{"schemaVersion":2,"authorityId":"ed25519:Df--2beY1D0DvraD-y2kGO5m3P6jC1DAOqUIhLkT6ZE","displayName":"Bitcadia Authority","sequence":5,"issuedAt":"2026-08-28T22:07:14Z","expiresAt":"2036-08-25T22:07:14Z","previousManifestSha256":"8be25b28b28a451970123cd2cf33685cbd0089bef96f7ffa3ef3be79c3ab0e1f","registry":{"documentType":"mod-registry-index-v1","url":"https://raw.githubusercontent.com/Bitcadia/Authority/main/sites/rhdc/catalog/adac251f19eaeed287acb6a29f89255ba3205a1575eecc8bb369f744fdc8ed84.json","sha256":"adac251f19eaeed287acb6a29f89255ba3205a1575eecc8bb369f744fdc8ed84","size":1834,"gameCount":1,"allowRedirects":false},"peers":[{"displayName":"Smash Remix","registry":{"documentType":"mod-registry-index-v1","url":"https://raw.githubusercontent.com/Bitcadia/Authority/main/sites/smashremix/catalog/5b14b749de5ce5ffb07319b772aaa16342b0399dafaf204e14ed499f766ce6d0.json","sha256":"5b14b749de5ce5ffb07319b772aaa16342b0399dafaf204e14ed499f766ce6d0","size":927,"gameCount":1,"allowRedirects":false},"manifestUrl":"https://smashremix.net/patcher/authority-manifest-v2.json","backupManifestUrls":["https://raw.githubusercontent.com/Bitcadia/Authority/main/sites/smashremix/authority-manifest-v2.json"],"manifestSha256":"a618118e3104ed317523909cf5a411c0e82a3dbe5fbd0843053d6ef6d2d35a49"},{"displayName":"Hylian Modding","registry":{"documentType":"mod-registry-index-v1","url":"https://raw.githubusercontent.com/Bitcadia/Authority/main/sites/hylian/catalog/6eadce8e75945b0232e5c564be84ea6f8733d7a87b100dcb861cebff1078d3af.json","sha256":"6eadce8e75945b0232e5c564be84ea6f8733d7a87b100dcb861cebff1078d3af","size":1486,"gameCount":2,"allowRedirects":false},"manifestUrl":"https://hylianmodding.com/authority-manifest-v2.json","backupManifestUrls":["https://raw.githubusercontent.com/Bitcadia/Authority/main/sites/hylian/authority-manifest-v2.json"],"manifestSha256":"5b184dbd75d3a7112ba8ce27adf0ad75652faf3d362aeba37d72881ff6e856cc"},{"displayName":"SM64 Romhacks","registry":{"documentType":"mod-registry-index-v1","url":"https://raw.githubusercontent.com/Bitcadia/Authority/main/sites/sm64/catalog/b2147cd88e543a0066dea7c5b2899e043da1ead46843720182f403fb86b89b55.json","sha256":"b2147cd88e543a0066dea7c5b2899e043da1ead46843720182f403fb86b89b55","size":959,"gameCount":1,"allowRedirects":false},"manifestUrl":"https://sm64romhacks.com/authority-manifest-v2.json","backupManifestUrls":["https://raw.githubusercontent.com/Bitcadia/Authority/main/sites/sm64/authority-manifest-v2.json"],"manifestSha256":"7f1b26351acdb127343f5751b62705be964a2e2795ecb33f668332319dc89d83"}]}