{"schemaVersion":2,"authorityId":"ed25519:Df--2beY1D0DvraD-y2kGO5m3P6jC1DAOqUIhLkT6ZE","displayName":"Bitcadia Authority","sequence":1,"issuedAt":"2026-08-31T23:47:32Z","expiresAt":"2036-08-28T23:47:32Z","previousManifestSha256":null,"registry":{"documentType":"mod-registry-index-v1","url":"https://raw.githubusercontent.com/Bitcadia/Authority/main/sites/rhdc/catalog/5062bb0009afd723c07eb8e4cef5d94b65212410b429691e32b8e12ec9c5cb38.json","sha256":"5062bb0009afd723c07eb8e4cef5d94b65212410b429691e32b8e12ec9c5cb38","size":1836,"gameCount":1,"allowRedirects":false},"peers":[{"displayName":"Smash Remix","registry":{"documentType":"mod-registry-index-v1","url":"https://raw.githubusercontent.com/Bitcadia/Authority/main/sites/smashremix/catalog/a29882d70ba621d96917accea97b4ccdd790a3d0de6ad85c1aea556ab9a43309.json","sha256":"a29882d70ba621d96917accea97b4ccdd790a3d0de6ad85c1aea556ab9a43309","size":1032,"gameCount":1,"allowRedirects":false},"manifestUrl":"https://raw.githubusercontent.com/Bitcadia/Authority/main/sites/smashremix/authority-manifest-v2-1-bitcadia64.json","manifestSha256":"42bcceb58f9f165014c525eb3b971bc13999c45cfc3f7912f7589c6c6ff6b723"},{"displayName":"Hylian Modding","registry":{"documentType":"mod-registry-index-v1","url":"https://raw.githubusercontent.com/Bitcadia/Authority/main/sites/hylian/catalog/f22fd28007dd61c462c8475473a771a011872f8562b78931eeae23fb265bdbb3.json","sha256":"f22fd28007dd61c462c8475473a771a011872f8562b78931eeae23fb265bdbb3","size":2299,"gameCount":2,"allowRedirects":false},"manifestUrl":"https://raw.githubusercontent.com/Bitcadia/Authority/main/sites/hylian/authority-manifest-v2-1-bitcadia64.json","manifestSha256":"90373ca24566a77860f54f96f9d88f7111988d1b1b9de4932b526d71ef9366d3"},{"displayName":"SM64 Romhacks","registry":{"documentType":"mod-registry-index-v1","url":"https://raw.githubusercontent.com/Bitcadia/Authority/main/sites/sm64/catalog/a2b65bf61b848a0f1232c9ad8e51a0f266783b38b9e330083df6066a2523bbd7.json","sha256":"a2b65bf61b848a0f1232c9ad8e51a0f266783b38b9e330083df6066a2523bbd7","size":961,"gameCount":1,"allowRedirects":false},"manifestUrl":"https://raw.githubusercontent.com/Bitcadia/Authority/main/sites/sm64/authority-manifest-v2-1-bitcadia64.json","manifestSha256":"55be34ae568800a01c90cfa8c6b769c03d141b81c01572d93b2a2f6a5f8b6ee2"}]}