{"schemaVersion":2,"authorityId":"ed25519:Df--2beY1D0DvraD-y2kGO5m3P6jC1DAOqUIhLkT6ZE","displayName":"Bitcadia Authority","sequence":10,"issuedAt":"2026-08-31T15:19:20Z","expiresAt":"2036-08-28T15:19:20Z","previousManifestSha256":"7372ddbcb96a23b4a1aff25fdb9165f31c15ef3fa7a331a388a0eedfad063c16","registry":{"documentType":"mod-registry-index-v1","url":"https://raw.githubusercontent.com/Bitcadia/Authority/main/sites/rhdc/catalog/b86d5c1e6380641caa197850f96ab74dfcdd81d8a56886c7dbae7ac38b56f1f1.json","sha256":"b86d5c1e6380641caa197850f96ab74dfcdd81d8a56886c7dbae7ac38b56f1f1","size":1834,"gameCount":1,"allowRedirects":false},"peers":[{"displayName":"Smash Remix","registry":{"documentType":"mod-registry-index-v1","url":"https://raw.githubusercontent.com/Bitcadia/Authority/main/sites/smashremix/catalog/5b14b749de5ce5ffb07319b772aaa16342b0399dafaf204e14ed499f766ce6d0.json","sha256":"5b14b749de5ce5ffb07319b772aaa16342b0399dafaf204e14ed499f766ce6d0","size":927,"gameCount":1,"allowRedirects":false},"manifestUrl":"https://smashremix.net/patcher/authority-manifest-v2.json","backupManifestUrls":["https://raw.githubusercontent.com/Bitcadia/Authority/main/sites/smashremix/authority-manifest-v2.json"],"manifestSha256":"a618118e3104ed317523909cf5a411c0e82a3dbe5fbd0843053d6ef6d2d35a49"},{"displayName":"Hylian Modding","registry":{"documentType":"mod-registry-index-v1","url":"https://raw.githubusercontent.com/Bitcadia/Authority/main/sites/hylian/catalog/d7428991e1c5bc1dbcf2bb6dc180712d18e59435499d45a8aeda5ba3017b8362.json","sha256":"d7428991e1c5bc1dbcf2bb6dc180712d18e59435499d45a8aeda5ba3017b8362","size":1943,"gameCount":2,"allowRedirects":false},"manifestUrl":"https://raw.githubusercontent.com/Bitcadia/Authority/main/sites/hylian/authority-manifest-v2-4.json","manifestSha256":"a4753ccaa34c4f0e4def005132a51f9818985d972f5222d81d926178d82293c0"},{"displayName":"SM64 Romhacks","registry":{"documentType":"mod-registry-index-v1","url":"https://raw.githubusercontent.com/Bitcadia/Authority/main/sites/sm64/catalog/b2147cd88e543a0066dea7c5b2899e043da1ead46843720182f403fb86b89b55.json","sha256":"b2147cd88e543a0066dea7c5b2899e043da1ead46843720182f403fb86b89b55","size":959,"gameCount":1,"allowRedirects":false},"manifestUrl":"https://sm64romhacks.com/authority-manifest-v2.json","backupManifestUrls":["https://raw.githubusercontent.com/Bitcadia/Authority/main/sites/sm64/authority-manifest-v2.json"],"manifestSha256":"7f1b26351acdb127343f5751b62705be964a2e2795ecb33f668332319dc89d83"}]}