{"schemaVersion":2,"authorityId":"ed25519:Df--2beY1D0DvraD-y2kGO5m3P6jC1DAOqUIhLkT6ZE","displayName":"Bitcadia Authority","sequence":1,"issuedAt":"2026-08-28T00:11:14Z","expiresAt":"2036-08-25T00:11:14Z","previousManifestSha256":null,"registry":{"documentType":"mod-registry-index-v1","url":"https://raw.githubusercontent.com/Bitcadia/Authority/main/catalog/028f0f10daf93fd03f89fdb064c219109effe177c1a09eadfb4ebe1f986d5724.json","sha256":"028f0f10daf93fd03f89fdb064c219109effe177c1a09eadfb4ebe1f986d5724","size":910,"gameCount":1,"allowRedirects":false},"peers":[]}