{"schemaVersion":2,"authorityId":"ed25519:A4Am7jdCAqDnq0SBKkBDBKGndSs-1E5avxNbAp43tcc","displayName":"SM64 Romhacks","sequence":1,"issuedAt":"2026-08-31T23:47:32Z","expiresAt":"2036-08-28T23:47:32Z","previousManifestSha256":null,"registry":{"documentType":"mod-registry-index-v1","url":"https://raw.githubusercontent.com/Bitcadia/Authority/main/sites/sm64/catalog/a2b65bf61b848a0f1232c9ad8e51a0f266783b38b9e330083df6066a2523bbd7.json","sha256":"a2b65bf61b848a0f1232c9ad8e51a0f266783b38b9e330083df6066a2523bbd7","size":961,"gameCount":1,"allowRedirects":false},"peers":[]}