{"schemaVersion":2,"authorityId":"ed25519:Df--2beY1D0DvraD-y2kGO5m3P6jC1DAOqUIhLkT6ZE","displayName":"Bitcadia Authority","sequence":2,"issuedAt":"2026-08-28T02:23:39Z","expiresAt":"2036-08-25T02:23:39Z","previousManifestSha256":"2a381c8c3b312eb4fe3f7423484d8dcff7575f9020525cb26de649fcf0a9d44f","registry":{"documentType":"mod-registry-index-v1","url":"https://raw.githubusercontent.com/Bitcadia/Authority/main/catalog/358118e88c0929d3d008199e9e4fd491ad7a0ad7827b59653772924a66ae3edd.json","sha256":"358118e88c0929d3d008199e9e4fd491ad7a0ad7827b59653772924a66ae3edd","size":2513,"gameCount":4,"allowRedirects":false},"peers":[]}