{"schemaVersion":2,"authorityId":"ed25519:pO2u4qZEmHlFp2TccUt3vYmc1pVNm-riyBnpwmLVUwg","displayName":"Hylian Modding","sequence":5,"issuedAt":"2026-08-31T16:35:25Z","expiresAt":"2036-08-28T16:35:25Z","previousManifestSha256":"a4753ccaa34c4f0e4def005132a51f9818985d972f5222d81d926178d82293c0","registry":{"documentType":"mod-registry-index-v1","url":"https://raw.githubusercontent.com/Bitcadia/Authority/main/sites/hylian/catalog/dcff04e9d60370c2bc604023f8e7b77f85ac489d4bc48710df7dc33d49b4fe60.json","sha256":"dcff04e9d60370c2bc604023f8e7b77f85ac489d4bc48710df7dc33d49b4fe60","size":1943,"gameCount":2,"allowRedirects":false},"peers":[]}