{"schemaVersion":2,"authorityId":"ed25519:GVmN8nDjUdyuaOFr333W9sRbdruOmWdBl2gZRsjY3Js","displayName":"Smash Remix","sequence":1,"issuedAt":"2026-08-28T02:49:42Z","expiresAt":"2036-08-25T02:49:42Z","previousManifestSha256":null,"registry":{"documentType":"mod-registry-index-v1","url":"https://raw.githubusercontent.com/Bitcadia/Authority/main/sites/smashremix/catalog/5b14b749de5ce5ffb07319b772aaa16342b0399dafaf204e14ed499f766ce6d0.json","sha256":"5b14b749de5ce5ffb07319b772aaa16342b0399dafaf204e14ed499f766ce6d0","size":927,"gameCount":1,"allowRedirects":false},"peers":[]}