{"schemaVersion":2,"authorityId":"ed25519:pO2u4qZEmHlFp2TccUt3vYmc1pVNm-riyBnpwmLVUwg","displayName":"Hylian Modding","sequence":3,"issuedAt":"2026-08-31T05:06:52Z","expiresAt":"2036-08-28T05:06:52Z","previousManifestSha256":"486462c00d65a701adbf192aeb16d6845a926d00689167ce24ec0d4ffaba6580","registry":{"documentType":"mod-registry-index-v1","url":"https://raw.githubusercontent.com/Bitcadia/Authority/main/sites/hylian/catalog/227a822c471cc6516a11e26c28a7e1823671dc7d9228b16024d300605c656e1c.json","sha256":"227a822c471cc6516a11e26c28a7e1823671dc7d9228b16024d300605c656e1c","size":1842,"gameCount":2,"allowRedirects":false},"peers":[]}