{"schemaVersion":2,"authorityId":"ed25519:pO2u4qZEmHlFp2TccUt3vYmc1pVNm-riyBnpwmLVUwg","displayName":"Hylian Modding","sequence":6,"issuedAt":"2026-08-31T17:05:10Z","expiresAt":"2036-08-28T17:05:10Z","previousManifestSha256":"e59b9826d0f88876301241ed2534f927707775cd64e93466042fac464792e2fb","registry":{"documentType":"mod-registry-index-v1","url":"https://raw.githubusercontent.com/Bitcadia/Authority/main/sites/hylian/catalog/0280433b89ffdd06ded639ccca8cb883859aba18eea41e1a3e0985f55b5f17c5.json","sha256":"0280433b89ffdd06ded639ccca8cb883859aba18eea41e1a3e0985f55b5f17c5","size":2297,"gameCount":2,"allowRedirects":false},"peers":[]}