{"schemaVersion":2,"authorityId":"ed25519:pO2u4qZEmHlFp2TccUt3vYmc1pVNm-riyBnpwmLVUwg","displayName":"Hylian Modding","sequence":1,"issuedAt":"2026-08-28T02:50:11Z","expiresAt":"2036-08-25T02:50:11Z","previousManifestSha256":null,"registry":{"documentType":"mod-registry-index-v1","url":"https://raw.githubusercontent.com/Bitcadia/Authority/main/sites/hylian/catalog/6eadce8e75945b0232e5c564be84ea6f8733d7a87b100dcb861cebff1078d3af.json","sha256":"6eadce8e75945b0232e5c564be84ea6f8733d7a87b100dcb861cebff1078d3af","size":1486,"gameCount":2,"allowRedirects":false},"peers":[]}