{"schemaVersion":2,"authorityId":"ed25519:pO2u4qZEmHlFp2TccUt3vYmc1pVNm-riyBnpwmLVUwg","displayName":"Hylian Modding","sequence":4,"issuedAt":"2026-08-31T15:19:20Z","expiresAt":"2036-08-28T15:19:20Z","previousManifestSha256":"fc6307e6de63ce57d8946f29eeb0b0fb5da8f113b1a1ea1ff31b75f7635fde01","registry":{"documentType":"mod-registry-index-v1","url":"https://raw.githubusercontent.com/Bitcadia/Authority/main/sites/hylian/catalog/d7428991e1c5bc1dbcf2bb6dc180712d18e59435499d45a8aeda5ba3017b8362.json","sha256":"d7428991e1c5bc1dbcf2bb6dc180712d18e59435499d45a8aeda5ba3017b8362","size":1943,"gameCount":2,"allowRedirects":false},"peers":[]}