{"schemaVersion":2,"authorityId":"ed25519:Df--2beY1D0DvraD-y2kGO5m3P6jC1DAOqUIhLkT6ZE","displayName":"Bitcadia Authority","sequence":13,"issuedAt":"2026-08-31T22:40:22Z","expiresAt":"2036-08-28T22:40:22Z","previousManifestSha256":"ddb0a408a4e148d4ffe8c92311d98f1ab5ceb21957fbaeec2e8f94ef91e0c271","registry":{"documentType":"mod-registry-index-v1","url":"https://raw.githubusercontent.com/Bitcadia/Authority/main/sites/rhdc/catalog/97d619b321f6d882250ed217d7b0c07155eb4f451a4f6c53fdcdfee041e46c4a.json","sha256":"97d619b321f6d882250ed217d7b0c07155eb4f451a4f6c53fdcdfee041e46c4a","size":1834,"gameCount":1,"allowRedirects":false},"peers":[{"displayName":"Smash Remix","registry":{"documentType":"mod-registry-index-v1","url":"https://raw.githubusercontent.com/Bitcadia/Authority/main/sites/smashremix/catalog/5b14b749de5ce5ffb07319b772aaa16342b0399dafaf204e14ed499f766ce6d0.json","sha256":"5b14b749de5ce5ffb07319b772aaa16342b0399dafaf204e14ed499f766ce6d0","size":927,"gameCount":1,"allowRedirects":false},"manifestUrl":"https://smashremix.net/patcher/authority-manifest-v2.json","backupManifestUrls":["https://raw.githubusercontent.com/Bitcadia/Authority/main/sites/smashremix/authority-manifest-v2.json"],"manifestSha256":"a618118e3104ed317523909cf5a411c0e82a3dbe5fbd0843053d6ef6d2d35a49"},{"displayName":"Hylian Modding","registry":{"documentType":"mod-registry-index-v1","url":"https://raw.githubusercontent.com/Bitcadia/Authority/main/sites/hylian/catalog/0280433b89ffdd06ded639ccca8cb883859aba18eea41e1a3e0985f55b5f17c5.json","sha256":"0280433b89ffdd06ded639ccca8cb883859aba18eea41e1a3e0985f55b5f17c5","size":2297,"gameCount":2,"allowRedirects":false},"manifestUrl":"https://raw.githubusercontent.com/Bitcadia/Authority/main/sites/hylian/authority-manifest-v2-6.json","manifestSha256":"c86ffb8a1b8a0e42b1c180f44edf603cca50318e8c59eee198ac469e98d6c192"},{"displayName":"SM64 Romhacks","registry":{"documentType":"mod-registry-index-v1","url":"https://raw.githubusercontent.com/Bitcadia/Authority/main/sites/sm64/catalog/b2147cd88e543a0066dea7c5b2899e043da1ead46843720182f403fb86b89b55.json","sha256":"b2147cd88e543a0066dea7c5b2899e043da1ead46843720182f403fb86b89b55","size":959,"gameCount":1,"allowRedirects":false},"manifestUrl":"https://sm64romhacks.com/authority-manifest-v2.json","backupManifestUrls":["https://raw.githubusercontent.com/Bitcadia/Authority/main/sites/sm64/authority-manifest-v2.json"],"manifestSha256":"7f1b26351acdb127343f5751b62705be964a2e2795ecb33f668332319dc89d83"}]}