{"schemaVersion":2,"authorityId":"ed25519:pO2u4qZEmHlFp2TccUt3vYmc1pVNm-riyBnpwmLVUwg","displayName":"Hylian Modding","sequence":2,"issuedAt":"2026-08-31T00:17:39Z","expiresAt":"2036-08-28T00:17:39Z","previousManifestSha256":"5b184dbd75d3a7112ba8ce27adf0ad75652faf3d362aeba37d72881ff6e856cc","registry":{"documentType":"mod-registry-index-v1","url":"https://raw.githubusercontent.com/Bitcadia/Authority/main/sites/hylian/catalog/0c0bad7039cef82b6b757e836043e4f6403dd481206c54d848b79aa3cf3141e6.json","sha256":"0c0bad7039cef82b6b757e836043e4f6403dd481206c54d848b79aa3cf3141e6","size":1486,"gameCount":2,"allowRedirects":false},"peers":[]}